Ch33-01,It's fun every time I read it.,每次读，我都觉得很有趣。,19
Ch33-01,This book looks fun.,这本书看起来很有趣。,20
Ch33-01,"Wow, the cover looks pretty. How about this book?",哇，封面很漂亮，这本书怎么样？,21
Ch33-01,That book again?,又是那本书？,22
Ch33-01,Is this book that much fun?,这本书有那么有趣吗？,23
Ch33-01,You chose a book that mommy really likes.,你选了一本妈咪真的很喜欢的书。,24
Ch33-01,This book is too hard / difficult.,这本书太难了。,25
Ch33-01,"Hmm, this book is for babies.",嗯，这是给小婴儿读的书。,26
Ch33-01,Why don't you choose another one?,你为什么不选其他本呢？,27
Ch33-01,Look at all the books that you brought!,看你拿了这么多的书！,28
Ch33-01,I'm going to lose my voice.,我快失去声音了。,29
Ch33-02,Now I am going to tell you the story of this book.,现在，我要跟你讲这本书的故事了。,1
Ch33-02,What is the title?,书名是什么？,2
Ch33-02,This book's title is The Elves and the shoemaker.,这本书的书名是《小精灵和鞋匠》。,3
Ch33-02,"The authors are the brothers Grimm, and the illustrator is Hannah.",作者是格林兄弟，插画家是汉娜。,4
Ch33-02,Let's look at the cover first. What do you see?,我们先看封面。你看到什么？,5
Ch33-02,"I see an old ma, some shoes, and elves, too.",我看到一个老人、一些鞋子和精灵。,6
Ch33-02,so what do you think will happen in the story? Let's find out !,那么，你觉得会发生什么故事呢？我们 来找出来吧！,7
Ch33-02,Look more closely at the pictures.,把图看得更仔细一点。,8
Ch33-02,I know that srory.,我知道那个故事。,9
Ch33-02,Let's check if this story is one you already know,我们来确定一下这个故事是不是你已经知道了。,10
Ch33-02,What will happen on the next page?,下一页，会发生什么事呢？,11
Ch33-02,Look at the picture. What do you think is happening?,看一下图，你觉得正在发生什么事情 呢？,12
Ch33-02,I think the bird will fly away.,我想那鸟要飞走了,13
Ch33-02,Really? I'll read and see if your guess is correct.,真的吗？我来读读看你的猜测对不对。,14
Ch33-02,Bingo! What you said was actually right.,结果！你说的是正确的。,15
Ch33-02,"Now, we are done reading the book. Did you guys like it?",现在，我们读完这本书了。你们喜欢 吗？,16
Ch33-02,"Yes. Read it again, please!",是的，请再读一次！,17
Ch33-02,Which part was the most interesting?,哪一个部分最有趣呢？,18
Ch33-02,It was so fun /sad /boring.,太有趣/伤感/无聊了。,19
Ch33-02,I like when the paper Bag Princess kicked the prince.,我喜欢纸袋公主踹王子的那一段。,20
Ch33-03,Let's try reading it out loud.,我们大声念出来吧。,1
Ch33-03,You can read it slowly.,你可以慢慢地念。,2
Ch33-03,"I will read this page, and you read the other side.",我念这一页，你念它的另一面。,3
Ch33-03,I think I have a sore throat from reading.,我念完之后，觉得喉哤痛。,4
Ch33-03,Your voice does not have to be very loud.,你的声音不需要太大声。,5
Ch33-03,"As Iong as you can hear yourseif, it's fine.",只要你自已能听得到就好。,6
Ch33-03,I can't hear you at all.,我根本就听不到你念的声音。,7
Ch33-03,It's okay if you get it wrong. I will help you.,错了也没关系，我会帮你。,8
Ch33-03,I want you to repeat after me as I read line by line.,当我一行一行的念，我希望你跟着复诵。,9
Ch33-03,I don't know how to read this word.,我不知道这个字怎么念。,10
Ch33-03,I can't really pronounce it.,我发不出这个音。,11
Ch33-03,"Try to sound it out. It starts with an ""1"".",你试着发音看看，从[1]开始。,12
Ch33-03,I will record it and let you listen to it .,我帮你录起来给你听。,13
Ch33-03,"If you keep on practicing, you will get better for sure. /Practice makes perfect.",如果你持续练习的话，你一定会念得更 好。,14
Ch33-03,"If I can't read, I want you to help me",如果我念不出来，请帮我。,15
Ch33-04,I don't want to read the book out loud.,我不想要朗读这本书。,1
Ch33-04,"Well, then today you can read silently.",那么，今天你就静静地读吧。,2
Ch33-04,But you srill have to read it thoroughly.,不过你还是必须把它读完。,3
Ch33-04,"Mom, I want the house to be quiet.",妈，我希望房间保持安静,4
Ch33-04,"Mom, I finished reading one book already.",妈，我已经读完一本了。,5
Ch33-04,"Wow, you read that fast?",哇，你读得那样快？,6
Ch33-04,Is there anything that you didn't understand while you were reading ？,你读的时候，有什么不懂的地方吗？,7
Ch33-04,You can always ask me.,你随时都可以问我。,8
Ch33-04,"Even if you don't know some words, just keep on reading.",就算有些字你不懂，也要继续读下去。,9
Ch33-04,"At the beginning, you might find it hard to read books silently.",刚开始，你或许会发现很难安静地读书。,10
Ch33-04,You will get used to it very soon.,你很快就会习惯。,11
Ch33-04,"Pay attention to the pictures, too. They all look interesting.",你也要好好看图，它们看起来都很有趣。,12
Ch33-04,Think about what the story is about as you are reading the book.,你一边读的时候，要一边想这是关于什 么的故事。,13
Ch33-04,It seems like you're not paying attention.,你好象没有集中精神。,14
Ch33-05,Is there any word that you don't know on this page?,在这页，你有不懂的单字吗？,1
Ch33-05,Do you remember this word?,你记得这个字吗？,2
Ch33-05,I remember seeing this word in another book.,我记得这个字在其他书中也出现过。,3
Ch33-05,Oh! I know that word! I've heard it.,喔！我知道那个字！我曾经听过。,4
Ch33-05,Is this your first time to see this word?,这是你第一次看到这个字吗？,5
Ch33-05,Let's take a look at the new words once more.,我们在看一次新的单字,6
Ch33-05,Should we mark the words that you learned today?,我们要标记一下你今天学的单字吗？,7
Ch33-05,Mommy will write the words on the blackboard.,妈妈会在黑板上写下这引起单字。,8
Ch33-05,"What does it mean in the story, Mom?",妈，它在故事里面是什么意思？,9
Ch33-05,Try to guess its meaning.,试着猜它的意思。,10
Ch33-05,Try to guess its meaning by looking before and after the word.,透过这个单字的前后文猜猜它的意思。,11
Ch33-05,Let's look it up in the dictionary.,我们用字典查一下。,12
Ch33-05,Do you want to look it up in the dictionary?,你想要用字典查吗？,13
Ch33-05,"That word means ""strong"".",那单字的意思是【强壮】。,14
Ch33-05,Try to think about what the word might mean one more time.,再想一想这个单字可能是什么意思。,15
Ch33-05,"Mom, its meaning is different from what I learned before.",妈，那个意思跟我之前学的不一样。,16
Ch33-05,The word has several meanings.,这个单字有几种意思。,17
Ch33-06,Who is the main character of the story?,这个故事的主人公是谁？,1
Ch33-06,The main characters are Hansel and Gretel.,主人公是什Hansel和Gretel。,2
Ch33-06,"What is the kid doing, and where is he doing it ?",那个小孩在做什么，他是在哪里做？,3
Ch33-06,Why did he act that way ?,为什么他那样做？,4
Ch33-06,What happened in the beginning?,刚开始，发生了什么事？,5
Ch33-06,Why did that happen?,为什么会发生那样的事？,6
Ch33-06,What happened in the middle of the story?,故事的中间发生了什么事？,7
Ch33-06,Now Iet's see the results of that action.,现在，我们来看看那样做的结果。,8
Ch33-06,How would he have felt in this situation?,这样的情况下，他的心情如何/,9
Ch33-06,What would you have done if that were you ?,如果是你的话，你会怎么做？,10
Ch33-06,I don't think I would have done that if I were him.,如果我是他的话，我想我不会那样做。,11
Ch33-06,"After that, what happened?",接下来，发生了什么事？,12
Ch33-06,What do you think will happen in the end?,你觉得最后会怎样发展？,13
Ch33-06,What happened at the end of the story?,故事的最后发生了什么事/,14
Ch33-06,How would you like the story to end ?,你希望故事怎样结束？,15
Ch33-06,How is the problem solved?,问题是如何解决的？,16
Ch33-06,The main character overcame the difficulty / challenge.,主人公克服了困难/挑战。,17
Ch33-06,The problem was solved when they found the lost key.,当他们找到遗失的钥匙，问题就解决了。,18
Ch33-06,I'm so relieved that the story ended happily.,我很欣慰是个幸福的结局。,19
Ch33-07,Let's see what characters are in this book.,我们看看这本书有什么角色,1
Ch33-07,An animal is the main character of this book.,动物是这本书的主人公,2
Ch33-07,What is the girl doing?,那个女孩在做什么,3
Ch33-07,Why was the boy mad in this part?,这一段，为什么男孩生气了？,4
Ch33-07,What kind of person is he?,他是个怎么样的人？,5
Ch33-07,Who do you like the most? / Who is your favorite character?,你最喜欢谁？,6
Ch33-07,I like Kipper the most.,我最喜欢Kipper。,7
Ch33-07,How old is Arthur?,Arthur几岁了？,8
Ch33-07,"Mom, Nate always eats pancakes.",妈，Nate总是吃薄煎饼。,9
Ch33-07,How come the fly talk?,苍蝇为何能说话？,10
Ch33-07,"Well, in books, animals can talk with one another.",嗯，在书中动物可以彼此交谈。,11
Ch33-07,"Mom, I think this boy is really silly.",妈，我觉得这男孩真傻。,12
Ch33-07,"Mom, where is this child's mother?",妈，这孩子的妈妈在哪里？,13
Ch33-07,Does he/she live alone?,他/她一个人生活吗？,14
Ch33-07,How come the princess is so ugly?,公主怎么会那么凶呢？,15
Ch33-07,There are several main characters in this book.,这本书有好几位主人公。,16
Ch33-07,I think DW is more like the main character than Arthur.,我想DW比Arthur更像主人公。,17
Ch33-07,What does the main character look like?,主角看起来像什么？,18
Ch33-07,What did the main character do?,主角做了什么？,19
Ch33-07,"Where, and with whom, does the main character live?",主角在哪里，和谁住在一起？,20
Ch33-07,How did his feelings change throughout the book?,随着故事 的发展，他的心情是怎么改变 的？,21
Ch33-08,Please listen carefully.,请仔细听。,1
Ch33-08,Concentrate and listen to the story.,集中精神听故事。,2
Ch33-08,You will hear a story from the CD.,你会从CD中听到故事。,3
Ch33-08,Look at the words as you are listening to it.,一边听一边看着这些字。,4
Ch33-08,You can point to the words with your finger while listening.,你可以边听边用手指头指着这些字。,5
Ch33-08,"Okay, I'll play the CD then.",好，那么我播放CD罗。,6
Ch33-08,Think about the story while you are listening.,边听边想想看这是什么故事。,7
Ch33-08,I want to listen to it one more time.,我想再听一次。,8
Ch33-08,Can you play the last few seconds again? / Can you play that last minute again?,你能把最后的那几秒再播放一遍吗？,9
Ch33-08,Can you go back and play the last track?,你能回去播放上一节吗？,10
Ch33-08,"Mom, can you stop the CD for a minute?",妈，你能暂停一下CD吗？,11
Ch33-08,I don't know where to read because the person is speaking too fast.,那个人读得太快，我不知道该看哪里了。,12
Ch33-08,Turn the page. It's on the middle part.,翻这一页，这是中间的部分。,13
Ch33-08,It's the 5th line from the bottom / top.,从下面/上面算来第五行。,14
Ch33-08,The voice sounds really funny. Haha!,那个声音真的很好笑。哈哈！,15
Ch33-08,It's too difficult. Iwant to listen to a different one.,这太难了。我想听其他的。,16
Ch33-08,I want you to read the book to me.,我想要你念这本书给我听。,17
Ch33-08,Do you want me to put the headphones on you?,你想要我帮你戴耳机吗？,18
Ch33-08,Are you doing fine listening to the story?,你在好好听故事吗？,19
Ch33-08,"Mommy finds this part to be the most fun, too.",妈咪也觉得这部分最有趣了。,20
Ch33-08,You missed that part.,你错过了那个部分罗。,21
Ch33-09,How was the book?,这本书如何？,1
Ch33-09,It was moving / fun / just okay.,很感动/有趣/一般。,2
Ch33-09,Was it too difficult for you?,对你来说，太难了吗？,3
Ch33-09,I understood most of it.,我几乎都能懂。,4
Ch33-09,I don't know what the story is about.,我不知道故事内容是什么。,5
Ch33-09,Do you want to talk about the story with Mommy?,你想跟妈咪讲讲这个帮事吗？,6
Ch33-09,Let's summarize the story together.,我们一起来对这个故事作个简短的总结。,7
Ch33-09,"Mom, let me tell you what the story is about.",妈，我跟你说这个故事在讲什么。,8
Ch33-09,Do you want to try writing a book report?,你要讲着写读书心得吗？,9
Ch33-09,Let's write a letter to the main character.,我们写封信给主人公吧。,10
Ch33-09,Why don't you and I do the role-playing activity together?,你要不要和我一起玩角色扮演？,11
Ch33-09,Write in your reading log since you're done reading it.,既然你都读完了，就写在阅读记录表上。,12
Ch33-09,I've read 200 books so far.,到目前为止，我读了200本书。,13
Ch34-01,"Mom, it's time to watch a DVD!",妈，是看DVD的时间了！,1
Ch34-01,"Mom, can I watch a DVD?",妈，我可以看DVD吗？,2
Ch34-01,What DVD do you want to watch today?,今天你要看什么DVD?,3
Ch34-01,Want to watch the new one that we recently bought?,你要看最近我们新买的那片吗？,4
Ch34-01,Please play Caillou.,请播放《Caillou》。,5
Ch34-01,I want to watch the Magic School Bus .,我要看《Magic School Bus》。,6
Ch34-01,Do you want me to choose it for you?,你要我帮你选吗？,7
Ch34-01,You have watched it too many times.,那个你已经看过很多次了。,8
Ch34-01,Why don't you try to choose another one?,试着选其他的看，如何？,9
Ch34-01,Can I see two DVDs today?,今天我可以看两片DVD吗？,10
Ch34-01,"Well, you know that watching too much TV is not good for you.",哦，你知道看太多电视对你不好。,11
Ch34-01,Can I watch it again?,我可以再看一次吗？,12
Ch34-01,I want to watch the one that I saw yesterday.,我想看我昨天 看的那一片。,13
Ch34-01,It's my turn to choose the DVD because Minsu picked his favorite yesterday.,因为昨天民肃选了他喜欢的，这次轮到 我选DVD了。,14
Ch34-01,We'll watch the DVD for 30 minutes only. Okay?,我们只看30分钟的DVD，知道吗？,15
Ch34-01,I like the Disney animations the most.,我最喜欢迪士尼的卡通了。,16
Ch34-01,I want the English subtitles.,我要有英文字幕的。,17
Ch34-01,Can I watch it with the subtitles on?,我可以打开字幕看吗？,18
Ch34-01,Let's watch it without any subtitles.,我们来看没有字幕的。,19
Ch34-01,You can watch it this time only.,你只能看这一次。,20
Ch34-01,"Well, let's stop here today.",嗯，我们今天就到这吧。,21
Ch34-01,Why don't you pick one by yourself?,自己选一片，如何？,22
Ch34-02,"Mom,how do I play the DVD?",妈，我要怎么播放DVD?,1
Ch34-02,"I will show you how,so watch carefully.",我示范给你看，仔细看好。,2
Ch34-02,Let's try to control it with the remote control.,我们试着用遥控器来操作。,3
Ch34-02,Place the DVD into the player.,把DVD放进播放器内。,4
Ch34-02,Handle it by inserting your index finger into the center hole.,把你的食指放入中间的洞来拿着。,5
Ch34-02,"If DVDS get scratched,they can be broken.",如果DVD被刮伤了，它们会被弄坏。,6
Ch34-02,"Mom,I want to play the DVD by myself.",妈，我想要自己播放DVD。,7
Ch34-02,"Okay,sure. Give it a try!",好，可以。你试试！,8
Ch34-02,Put the lid back and push the play button.,盖上盖子后，按下播放键。,9
Ch34-02,Change the TV into ‖outside input‖ mode.,把电视转到“外部输入”的模式。,10
Ch34-02,"Mom,it does not work. / it's not working.",妈，它不动耶。,11
Ch34-02,I saw this part already.Please skip the movie to the next part.,我已经看过这部分了，请跳到下一部分。,12
Ch34-02,It's too loud. Please turn it down.,声音太大了。请转小声。,13
Ch34-02,Don't you think the sound is already too loud?,你不觉得声音已经太大了吗？,14
Ch34-02,I think this will bejust right.,我想这刚刚好。,15
Ch34-02,Can you please turn thevolume up a little?,你能把音量调大一点吗？,16
Ch34-02,Do you want me to turnup the volume a little bit?,你要我把音量调大一点吗？,17
Ch34-02,"If you listen to it thatloud,your ears will get hurt.",如果你听得那么大声，你的耳朵会受伤的。,18
Ch34-02,Press the stop button.,按下停止键。,19
Ch34-02,"When the disc stopsspinning,we'll take it out.",当光碟停止转动，我们就把它拿出来。,20
Ch34-02,"When you are finished,be sure to turn the TV and audio off.",当你看完时，一定要把电视和音响关掉。,21
Ch34-02,Put the DVD back intothe case carefully.,把DVD 小心地放入盒子内。,22
Ch35-01,"The title of the book is Thank You, Mr.Falker.          ","这本书的书名是《ThankYOU,Mr.Fallker》",1
Ch35-01,The author of the bookis Patricia Polacco.        ,这本书的作者是Patricia Polacco。,2
Ch35-01,The illustrator isAmanda Smith.                , 插画家是Amanda Smith。,3
Ch35-01,The main character ofthe story is Trisha.         ,故事的主人公是Trisha。,4
Ch35-01,The main characters areTrisha and Mr. Falker.   ,主人公是Trisha 和Falker 先生。,5
Ch35-01,The setting of the storyis the 1950s.,故事的背景是1950 年代。,6
Ch35-01,I like the story becauseMr. Falker is a great teacher.         ,我喜欢这个故事，因为Falker 先生是很优秀的老师。,7
Ch35-01,My favorite part is whenTrisha learns how to read  with Mr. Falker,我最喜欢的部分是Trisha 跟Falker 先生学习怎样阅读。,8
Ch35-02,I will write a journalin English.                           , 我将要用英文写日记。,1
Ch35-02,I was so excited today.                                ,今天我很兴奋。,2
Ch35-02,Playing tag was reallyfun.                               ,玩捉迷藏真的很有趣。,3
Ch35-02,Today is such afantastic day!                            , 今天是这么棒的一天！,4
Ch35-02,I hope every day will belike today.                       , 我希望每天都可以像今天这样。,5
Ch35-02,I am so happy my mombought me new pants.          , 我妈买了新的裤子给我，我好开心。,6
Ch35-02,I was so happy that Ijumped up and down.             ,我太开心了，所以我蹦蹦跳跳地。,7
Ch35-02,I will never forgettoday.                              ,我绝对忘不了今天。,8
Ch35-02,I'm very happy because I got a perfect score on my test.,因为我考试考了满分，所以我很开心。,9
Ch35-02,I was laughing to death.                            ,我笑死了。,10
Ch35-02,"It was my first time toride on a train, and I felt  amazing.",这次我第一次搭火车，我感到很惊奇。,11
Ch35-02,I feel terrible.                                            ,我心情很差。,12
Ch35-02,I'm really distressed.                                    ,我真的很伤心。,13
Ch35-02,I fought with my friend.                                     ,我和朋友打架了。,14
Ch35-02,I lost my money.                                          ,我把钱弄不见了。,15
Ch35-02,I got annoyed at everything.,我对所有事情都感到很烦。,16
Ch35-02,The toy that I like the most is broken.,我最喜欢的玩具坏了。,17
Ch35-02,I am worried that I might not be able to get it fixed.,我担心我可能无法把它修好。,18
Ch35-02,A big kid hit me in the back at school.,在学校有个高大的小孩打我的背。,19
Ch35-02,I had to force myself not to cry. / I tried not to cry very hard.,我必须强迫自己不要哭。/我试着不要哭 太大声。,20
Ch35-02,I feel sorry for my brother because I got mad at him.,我对我弟弟感到很抱歉，因为我对他发 脾气了。,21
Ch35-02,I am very depressed because I got scolded by Mom.,我蜚常郁闷，因为我被妈妈责备了。,22
Ch35-02,I was very sad because my friend moved away.,因为我朋友搬家了，所以我很伤心。,23
Ch35-02,I feel bad and sad about not winning the prize.,我对于没有得奖感 到又伤心又难受。,24
Ch35-02,I wanted to hit my sister so much.,我真的很想打我姐姐。,25
Ch35-02,I could not go out today because of the rain.,因为下雨，我今天不能出门。,26
Ch35-02,So many bad things kept happening today.,今天一直发生很多坏事。,27
Ch35-02,My heart was aching so much because my fish died.,我的心很痛，因为我的鱼死了。,28
Ch36-01,I have some really good news for you.,我有个好消息要告诉你。,1
Ch36-01,Mom is having a baby!,妈妈有小宝宝了！,2
Ch36-01,Mommy has a baby here.,妈咪这里有小宝宝。,3
Ch36-01,You will have a baby brother or sister soon.,你很快就会有个弟弟或妹妹了。,4
Ch36-01,You're going to be a big sister.,你要当姐姐了。,5
Ch36-01,The baby will look exactly like you.,小孩会看起来跟你很像。,6
Ch36-01,"Wow, am I going to be a big sister now?",哇！我现在要当姐姐了吗？,7
Ch36-01,Now I have a baby brother!,现在，我也有弟弟了！,8
Ch36-01,Now I have a baby sister!,现在，我也有妹妹了！,9
Ch36-01,I have always envied my friends who have younger brothers / sisters.,我一直很羡慕有弟弟/妹妹的朋友。,10
Ch36-01,Are you going to play well with your baby brother or sister?,你会跟你的弟弟或妹妹好好玩吧。,11
Ch36-01,I will be nice to the baby.,我会对小宝宝很好的。,12
Ch36-01,I will share my toys with my brother or sister.,我会把我的玩具分给弟弟或妹妹玩。,13
Ch36-01,Let's call Grandma and tell her the good news!,我们给奶奶打电话，告诉她这个好消息吧。,14
Ch36-02,What's the baby's name?,小孩的名字是什么？,1
Ch36-02,We haven't decided yet. Let's just call it Rabbit for now.,我们还没有决定。现在我们先叫他“兔 兔“吧。,2
Ch36-02,The baby's pre-birth name is Button.,小宝宝的胎名是“钮扣”。,3
Ch36-02,Do you want a baby sister or brother?,你想要妹妹，还是弟弟？,4
Ch36-02,I want a pretty baby sister.,我想要美丽的妹妹。,5
Ch36-02,What do you like for your baby brother's name?,你想要你的弟弟叫什么名字？,6
Ch36-02,I think Wensu will be a good name.,我想文宿是个好名字。,7
Ch36-02,I want to call him Wensu.,我想叫他文宿。,8
Ch36-02,Make sure you don't only love the baby. Okay?,你保证不可以只疼小宝宝，好吗？,9
Ch36-02,"Both of you are our children, so I will love both of you equally.",你们两个都是我的小孩，所以你们两个 我都爱。,10
Ch36-02,Of course! Mom loves Songjin the most. The baby is the next.,当然！妈妈最爱宋锦了，然后才是小宝 宝。,11
Ch36-02,Is there a baby inside Mummy's tummy?,妈咪的肚子里面有个小宝宝吗？,12
Ch36-02,The baby will be growing in my tummy for the next ten months.,接下来是个月小宝宝会在妈妈的肚子里 面长大。,13
Ch36-02,So I need help from you from now on.,所以，从现在起我需要你的帮忙。,14
Ch36-02,"Don't worry, Mom. I will help you out with all the hard work.",妈咪，不用担心，我会帮你做所有辛苦 的事情。,15
Ch36-03,I have to see my doctor for a regular checkup today.,我今天要去看医生做定期检查。,1
Ch36-03,When is the baby due?,小宝宝何时出来？,2
Ch36-03,How many days are left till the due date?,离预产期还有多少天？,3
Ch36-03,Why isn't the baby coming out yet?,为什么小宝宝还没出来？,4
Ch36-03,"Well, it's still far away.",是呀，还久呢。,5
Ch36-03,You have to wait a long time.,你还要等一段时间。,6
Ch36-03,It seems like he's /she's not ready to see the world.,听起来，他\她还没有做好来世界的准备。,7
Ch36-03,The baby will be born in a month.,小宝宝会在一个月后出生。,8
Ch36-03,Fifteen days are left till the baby's due date.,离预产期还有15天。,9
Ch36-03,"In a week or so, the baby will come out.",大约再过一周，小宝宝就要出来了。,10
Ch36-03,It's almost time for the baby to come.,小宝宝出生的时间快到了。,11
Ch36-03,"In a few days, you will meet your baby brother.",再过几天，你就会看到你的弟弟了。,12
Ch36-03,Tommorow is the due date for the baby.,明天就是宝宝的预产期了。,13
Ch36-03,"Well, the due date has passed, but the baby is still not coming out.",哎呀，预产期已经过了，但是小宝宝还 是没有出来。,14
Ch36-03,I can't wait to see my baby brother.,我等不及跟我的弟弟见面了。,15
Ch36-04,"Hi, baby. This is your Mommy.",嗨，小宝宝，我是妈咪。,1
Ch36-04,"Sweetie, do you hear Mommy's voice?",甜心，你听到妈妈的声音了吗？,2
