Ch06-11,Please speak calmly.,请平静地说。,11
Ch06-11,I'm going to listen if you speak properly.,你好好说的话，我会听得。,12
Ch06-11,Tell me if there's something wrong.,告诉我你有什么不满。,13
Ch06-11,Nobody pays attention to me.,没有人关心我。,14
Ch06-11,I'm just annoyed./I just don't feel well.,我只是不开心。,15
Ch06-11,I don't know why I feel annoyed.,我也不知道为什么不开心。,16
Ch06-11,"When you're angry, you look ugly.",当你生气时，脸很难看。,17
Ch06-11,"If you feel bad, nothing goes right.",如果你感觉差，没有事会顺利。,18
Ch06-11,That's not something you felt bad about.,那不是你要生气的事情。,19
Ch06-12,I can't stand it.,我再也忍不下去了。,1
Ch06-12,You should be grounded.,你一定要被处罚。,2
Ch06-12,"You deserve punishment, don't you?",你应该被罚，不是吗？ ,3
Ch06-12,Tell me what you did wrong.,告诉我你做错了什么。 ,4
Ch06-12,It was not my fault.,这不是我的错。 ,5
Ch06-12,Timeout! Sit in the Thinking Chair.,这是处罚，坐到反省的椅子上。 ,6
Ch06-12,"You know what you did wrong, right?",你知道你做错了什么，对吧？ ,7
Ch06-12,Mommy doesn't want to punish you.,妈妈也不想要处罚你。 ,8
Ch06-12,But you should be responsible for your actions.,但是你应该对你的行为负责。 ,9
Ch06-12,"Mom, I'm sorry.",妈妈，对不起。 ,10
Ch06-12,Please forgive me.,请原谅我。 ,11
Ch06-12,I won't ever do it again.,我不会再这样做了。 ,12
Ch06-12,You can't watch TV because of your wrongdoing.,因为你犯错了，所以你不能看电视。 ,13
Ch06-12,You're grounded and can't use the computer because of what you did today.,因为你今天做的事情，你要被罚不能看 电脑。 ,14
Ch06-12,Don't just say sorry.,不要只是说对不起。 ,15
Ch06-12,Go write an apology letter.,去写道歉信。 ,16
Ch06-12,It's all for your own good.,这都是为了你好。 ,17
Ch06-13,Say sorry to each other.,互相说对不起。,1
Ch06-13,Who wants to apologize first?,谁要先道歉？,2
Ch06-13,I'm sorry.,对不起。,3
Ch06-13,I mean it.,我是诚心地道歉。,4
Ch06-13,I'll be careful next time.,我下次会小心的。,5
Ch06-13,Shake hands with each other.,互相握手吧。,6
Ch06-13,Look at each other in the eyes and say sorry.,看着对方的眼睛说对不起。,7
Ch06-13,Don't blame others for that.,不要因此指责别人。,8
Ch06-13,Say sorry sincerely.,诚心地说对不起。,9
Ch06-13,Let's make sure this never happens again. All right?,让我们确认这种事以后都不会发生，好 吗？,10
Ch06-13,Let's get along.,我们和好吧。,11
Ch06-13,I didn't do it on purpose.,我不是故意那样的。,12
Ch06-13,I didn't mean it that way.,我不是那个意思。,13
Ch06-13,It was a mistake. I'm really sorry.,我错了，真的很对不起。,14
Ch06-13,You owe me a big apology.,你欠我一个正式的道歉。,15
Ch06-14,I'm so sorry for that.,那个，真的很对不起。,1
Ch06-14,Were you really upset?,你真的很伤心吧。,2
Ch06-14,Think for yourself. It was your fault.,想一想，这是你的错。,3
Ch06-14,Did you hate me because I scolded you?,因为我责备你，所以你讨厌我了吗？,4
Ch06-14,"Mommy was really upset, too.",妈妈也很不开心。,5
Ch06-14,Why did you let out a huge sigh?,为什么叹那样大的气？,6
Ch06-14,Is it very disappointing?,这很令人失望吗？,7
Ch06-14,You must have been devastated.,你一定很受伤吧？,8
Ch06-14,I want you to grow up to be a wonderful person.,我希望你能成为很棒的人。,9
Ch06-14,Can I hug you now?,现在我可以抱你吗。,10
Ch06-14,Come here. I'll give you a kiss.,来这里，妈妈亲你一下。,11
Ch06-14,"You know how Mommy feels, right?",你知道妈妈的心情，对吧？,12
Ch06-14,Don't be upset anymore.,不要再不开心了。,13
Ch06-14,Can I trust you now?,现在我可以相信你吧？,14
Ch06-14,Mommy trusts you.,妈妈相信你。,15
Ch06-14,Want to eat something delicious?,要不要吃点好吃的呢？,16
Ch06-14,Want to go for a walk.,要不要去散步？,17
Ch06-14,"I was scared when you were mad, Mommy.",妈咪，当你生气时我好害怕哦。,18
Ch06-14,I didn't do it because I hated you.,我不是因为讨厌你才那样做。,19
Ch06-14,Mommy was too mean. I'm sorry.,妈妈太暴躁了，对不起。,20
Ch06-14,But you are still my loving baby.,但是你还是我的心爱宝贝。,21
Ch07-01,Wait.,等一下。,1
Ch07-01,That's not the right thing to do.,那不是正确的行为。,2
Ch07-01,Is that what you should be doing?,那是你应该做的吗？,3
Ch07-01,Do what you are supposed to do.,做你应该做的事情。,4
Ch07-01,That's what I'm not pleased with.,那是我不喜欢的行为。,5
Ch07-01,This is not what should happen.,这是不该发生的事。,6
Ch07-01,I told you to stop.,我叫你停止了。,7
Ch07-01,Why do you always think I'm wrong?,为什么你总是认为我做错呢。,8
Ch07-01,What did I do wrong?,我做错了什么？,9
Ch07-01,It seems like you shouldn't do that.,那样做好像是不行的。,10
Ch07-01,Then what should I do?,那么，我应该怎样做呢？,11
Ch07-01,Think of something else.,想想其他方法。,12
Ch07-01,I hope you won't do it.,我希望你不要那样做。,13
Ch07-01,That's not necessary.,没有那个必要。,14
Ch07-01,Tell me what you did wrong.,告诉我你哪里做错了。,15
Ch07-01,Why do you keep doing that?,为什么你还继续那样做？,16
Ch07-01,Do you think you did the right thing?,你认为你做对了吗？,17
Ch07-01,That's not a good idea.,那不是个好的想法。,18
Ch07-02,Don't shout.,不要大叫。,1
Ch07-02,Stop being angry.,不要发脾气。,2
Ch07-02,Stop taking out your anger.,停止发脾气。,3
Ch07-02,Don't lose your temper so quickly. That's not good.,不要突然发脾气，那不是很好。,4
Ch07-02,Don't take out your anger on others.,不要把脾气发在别人身上。,5
Ch07-02,That's a bad word. Don't say that!,那是不好的话，不可以那样说！,6
Ch07-02,"If you can't control yourself, I'm going to punish you.",如果你不能管好自己的话，我就会处罚 你。,7
Ch07-02,Be patient!,忍一下！,8
Ch07-02,The one who controls his anger wins.,谁能忍住脾气，谁就是赢家。,9
Ch07-02,You need to get your anger under control.,你需要让你的脾气在控制之下。,10
Ch07-02,Why are you taking out your anger?,你为什么发脾气呢？,11
Ch07-02,Don't frown. Smile.,不要皱眉头了，笑一笑。,12
Ch07-02,I'm just so mad I don't know what to do。,我只是太生气，所以不知道该做什么。,13
Ch07-02,I don't want to talk to you.,我不要跟你说话。,14
Ch07-02,Why do you care?,你干嘛在意？,15
Ch07-02,"Then I'm going to get mad at you, too.",那么，我也要对你发脾气了。,16
Ch07-03,Don't run. You could trip and fall.,不要跑，你会跌倒的。,1
Ch07-03,There are a lot of cars.,车子很多。,2
Ch07-03,It's dangerous. There's a car coming.,危险。车子来了。,3
Ch07-03,Be extra careful on a curve.,在转弯处要特别小心。,4
Ch07-03,Look around to see if there are any cars.,要四周看看是否有车子来。,5
Ch07-03,Walk on the inner side of the sidewalk.,走在人行道内侧。,6
Ch07-03,Hold my hand.,牵住我的手。,7
Ch07-03,"Walk with me, Honey.",跟我一起走，宝贝。,8
Ch07-03,The road's dangerous. Don't run.,路上很危险，不要跑。,9
Ch07-03,Look straight ahead and walk.,要好好看着前面走。,10
Ch07-03,Be careful! There's someone in your way.,小心！前面有人。,11
Ch07-03,Don't run where there are a lot of people.,不要在人很多的地方跑来跑去。,12
Ch07-03,Wait! It is telling you to stop.,等一下，这里不是写着禁止吗？,13
Ch07-03,You fell down doing that the last time.,你上次也是那样才跌倒的？,14
Ch07-03,How come you ran ahead of us?,你怎么跑到我们前面去了？,15
Ch07-03,"Come on, Mommy! Hurry up!",妈妈，快来！快点！,16
Ch07-03,I was shocked because I thought I had lost you.,我以为跟你走丢了，吓了一跳。,17
Ch07-03,I almost fell down like you warned me.,我跟你说的一样差点跌倒了。,18
Ch07-03,"Oh, gosh! It was a close call.",哦，千钧一发。,19
Ch07-04,The floor is shaking.,地板在震动了。,1
Ch07-04,Go outside and run.,去外面跑。,2
Ch07-04,You walk in the house.,你在屋内要用走的。,3
Ch07-04,Walk on your tiptoes.,踮起脚尖走。,4
Ch07-04,Who's running in the house?,是谁在房子里面跑?,5
Ch07-04,I didn't run much.,我没有乱跑.,6
Ch07-04,Your brother's running because you are running.,"因为你在跑,连你弟弟也一起跑了",7
Ch07-04,"No,don't jump like that.","不可以,不可以那样跳.",8
Ch07-04,Don't jump off the couch.,不要从沙发上跳下来.,9
Ch07-04,Don't jump on the couch. There is dust everywhere.,"不可以在沙发上跳,到处都是灰尘.",10
Ch07-04,The janitor is going to come up.,警卫要上来了.,11
Ch07-04,You should never run at night.,你绝对不可以在晚上跑.,12
Ch07-04,The neighbors are sleeping now.,现在邻居们都睡觉了.,13
Ch07-04,The people downstairs are going to say it's loud.,楼下的人会抗议太吵了.,14
Ch07-04,Do you like it if you hear stomping from upstairs neighbor?,你会喜欢听到从楼上的邻居传来脚踏的 声音吗?,15
Ch07-05,"No,it's dangerous.","不可以,危险.",1
Ch07-05,Move far away.,"走开,离远一点.",2
Ch07-05,Step back/Move back.,往后退.,3
Ch07-05,You could bleed.,你会流血的.,4
Ch07-05,Don't come near.,不要靠近过来.,5
Ch07-05,What happens if I touch this?,"如果我碰到这个,会怎么样呢?",6
Ch07-05,"If you touch it, you'll get in trouble.","碰到的话,你会有麻烦的哦.",7
Ch07-05,I don't want you to touch it.,我不希望你去碰它.,8
Ch07-05,Don't touch it because it's very dangerous.,"不要碰它,因为很危险.",9
Ch07-05,Don't let your brother touch it.,不要让你弟弟碰到.,10
Ch07-05,Why can't I touch it?,为什么我不能碰?,11
Ch07-05,You could get hurt.,你可能会受伤.,12
Ch07-05,It's hot/sharp.,这很烫./很锐利.,13
Ch07-05,Not yet. You can touch it when you grow up.,"还不行,等你长大后才可以碰.",14
Ch07-05,Let me put this out of your reach.,我把这个放在你拿不到的地方.,15
Ch07-05,"If you get hurt, Mommy will be sad.","如果你受伤,妈妈会难过的.",16
Ch07-05,let's promise never to touch it.,"答应我,绝对不可以碰.",17
Ch07-05,You should've asked mommy first.,你那时应该先问过妈妈.,18
Ch07-05,That could have been dangerous.,那也有可能很危险.,19
Ch07-06,You'd better not touch it.,你最好不要碰那个.,1
Ch07-06,Don't touch it because it's your brother's.,"这是你哥哥的东西,不要碰喔.",2
Ch07-06,Your sister is not going to like it if you touch it.,"如果你碰了这个东西,你妹妹会不开心喔.",3
Ch07-06,Your sister really cares about it .,你妹妹真的很珍惜那个东西.,4
Ch07-06,I just want to look at it.,我只是想看看已.,5
Ch07-06,I'll leave it right after I see it .,我看完后会把它放回原位.,6
Ch07-06,Do you like when someone touches your stuff.,你会喜欢有人碰你的东西吗?,7
Ch07-06,Did your sister allow you to touch it?,你妹妹同意你碰了吗?,8
Ch07-06,Ask first and then play with it.,"先去问,再来跟它玩.",9
Ch07-06,I won't help you when your sister gets mad.,"如果你妹妹生气的话,我不会帮你的.",10
Ch07-06,Handle it careful and then put it back.,"小心地拿,然后放回原位.",11
Ch07-06,"Mom, can you keep it a secret?","妈妈,你能帮我保密吗?",12
Ch07-06,Please don't tell her I played with this.,请不要告诉妹妹我玩了这个.,13
Ch07-06,What if it broke?,万一坏了怎么办?,14
Ch07-06,Your sister will get mad for sure.,你妹妹当然会生气.,15
Ch07-06,"She touched mine,too.",妹妹也会拿我的东西.,16
Ch07-06,Can't you let your little sister play with it for a while?,你能把这个让你的妹妹玩一会吗?,17
Ch07-07,What's this? Who did this?,这是什么?谁做的?,1
Ch07-07,Who scribbled all over the wall?,是谁把墙壁涂鸦得乱七八糟?,2
Ch07-07,Why did you draw here?,你为什么在这里画画?,3
Ch07-07,Drawing should be done on paper.,你应该在纸上画画.,4
Ch07-07,I want to draw.,我想要画画.,5
Ch07-07,I'll erase it later.,我等一下会擦掉.,6
Ch07-07,This won't come off.,这是擦不掉的.,7
Ch07-07,You should have asked mommy for paper.,你应该跟妈妈要纸张.,8
Ch07-07,"Ask for paper next time, Ok?","下次要跟我拿纸张,知道吗?",9
Ch07-07,"Since you drew it,you should erase it.","是你画的,你要负责擦掉.",10
Ch07-07,Are you happy now since it's so dirty?,"弄得这样脏,现在你高兴了吗?",11
Ch07-07,You shouldn't just be scribbling everywhere.,你不可以在任何地方涂鸦.,12
Ch07-07,Mommy's upset because the floor is so dirty.,"妈妈很不高兴,因为地板被弄得很脏.",13
Ch07-07,Draw on this.,在这里画.,14
Ch07-08,Don't talk to strangers.,不要跟陌生人说话.,1
Ch07-08,Don't follow anyone even if they ask.,"即使有人要求,你也不可以跟他一起走.",2
Ch07-08,Don't tell a stranger your name or number.,不要告诉陌生人你的姓名和电话,3
Ch07-08,Tell your teacher or mom if something weird happens.,如果发生奇怪的事要告诉老师或妈妈.,4
Ch07-08,Ask for help when a stranger comes.,有奇怪的人出现时要请求帮忙,5
Ch07-08,Don't go near a stranger's car.,不要靠近陌生人的车子.,6
Ch07-08,Don't get in a stranger's car.,不要坐陌生人的车.,7
Ch07-08,Just say no firmly.,要坚决地说不.,8
Ch07-08,Only walk on busy streets.,你要走大路.,9
Ch07-08,Walk where people can see you.,走在有人可以看到你的地方.,10
Ch07-08,Just run if something feels wrong.,"觉得不对劲时,绝对要跑开.",11
Ch07-09,It's so dirty.,太脏了,1
Ch07-09,What's on your body?,你的身体沾到什么了?,2
Ch07-09,Look at the mirror.,照照镜子.,3
Ch07-09,You smell bad.,你闻起来很臭.,4
Ch07-09,Shouldn't you wash up?,你不是应该洗一下吗?,5
Ch07-09,I'm not that dirty.,我没有那么脏.,6
Ch07-09,Go to the bathroom.,进去浴室.,7
Ch07-09,There's dirt on you. Want me to wash it off.,"有脏东西在你身上,要我把它洗掉吗?",8
Ch07-09,You should look better if you were cleaner.,"如果你更干净,你会更好看的.",9
Ch07-09,Go change.,去换衣服.,10
Ch07-09,Where did you get so dirty?,你在哪里弄得这么脏呢?,11
Ch07-09,What happened to your new shirt?,你的新衬衫发生了什么事?,12
Ch07-09,Germs will love to live in you.,细菌会喜欢跟你一起住的.,13
Ch07-09,You could get sick if you're so dirty.,"这样脏的话,你会生病的.",14
Ch07-10,Can you clean your room?,你能整理下房间吗?,1
Ch07-10,Clear up your desk.,整理一下书桌吧.,2
Ch07-10,Your room is too dirty.,你的房间太脏了.,3
Ch07-10,I just cleaned up.,我刚整理好.,4
Ch07-10,You should clean up own room.,你应该整理自己的房间.,5
Ch07-10,I can't even walk by.,我连走都走不进去.,6
Ch07-10,There's no room to walk.,我连可以走的空间都没有了.,7
Ch07-10,Where should this go?,这个应该放在哪里.,8
Ch07-10,How can a person live in here?,这是人住的房间吗?,9
Ch07-10,Junk is all over the place.,整个地方都是垃圾.,10
Ch07-10,It's hard to find things now.,现在这样很难找东西.,11
Ch07-10,Your messy room drives me crazy.,你脏乱的房间快把我搞疯了.,12
Ch07-10,I'll come by in 10 minutes.,我10分钟后再来.,13
Ch07-10,I want to be it clean by then.,"到时,我希望它被整理好.",14
Ch07-10,"My brother did it, too.Why should I clean it alone?","弟弟也弄乱,为什么只有我要整理呢?",15
Ch07-10,I didn't make this mess.,这个脏乱不是我弄的.,16
Ch07-10,Help your brother clean up.,帮你弟弟整理一下.,17
Ch07-10,Want to have a match to see who can clean up faster?,想要比赛看谁比较快整理好吗?,18
Ch07-10,"Your teacher is coming soon, so let's clean it.","你的老师快来了,我们来整理它吧.",19
Ch07-10,Call mommy when you're done cleaning.,"你整理好后,叫妈妈一下.",20
Ch07-10,What do you do when you're done playing?,"当你不玩时,你应该做什么呢?",21
Ch07-10,I need to clean up.,我需要整理.,22
Ch07-10,Let's organize them by color.,我们按照颜色整理它们.,23
Ch07-10,Place them according to their size.,根据大小把它们放好.,24
Ch07-10,"Mom,where does this toy go?","妈妈,这个玩具要放哪?",25
Ch07-11,It's bad to hit others.,打人是不好的.,1
Ch07-11,Never hit others.,绝对不可以打人.,2
Ch07-11,You shouldn't hurt other people.,你不应该伤害其它人.,3
Ch07-11,Hold it even if you want to hit him.,"即使你想打他,也要忍下来.",4
Ch07-11,I hate him so badly that I don't know what to do.,"我太讨厌他了,以至于我不知道该怎么做.",5
Ch07-11,He hit me first.,是他先打我的.,6
Ch07-11,"Don't hit him,talk to him.","不要用打的,要用说的.",7
Ch07-11,"You will do the wrong thing, too if you hit him back.","你打回去的话,你也是不对的.",8
Ch07-11,Your friend's going to be hurt if you hit him.,"你打他的话,你朋友会受伤的.",9
Ch07-11,I told you never to do that.,我告诉过你绝对不可以那样做.,10
Ch07-11,You need to get in trouble.,你需要被处罚.,11
Ch07-11,Wan me to call the cops?,你要我去叫警察吗?,12
Ch07-11,You must not hit girls.,你不可以打女孩.,13
Ch07-11,Your friend's going to want to play with you now. Are you fine with it?,"现在你的朋友不会想跟你玩,这样你也可 以吗?",14
Ch08-01,Don't watch TV while laying down.,不要躺着看电视.,1
Ch08-01,Alright.,好啦.,2
Ch08-01,Sit properly.,坐好.,3
Ch08-01,Sit comfortably.,舒服点坐.,4
Ch08-01,Sit crisscross.,盘腿坐.,5
Ch08-01,Straighten your back. Keep your back straight.,腰挺直.,6
Ch08-01,Sit on your bottom.,"屁股贴着椅子,",7
Ch08-01,Sit all the way down.,整个坐下去.,8
Ch08-01,Don't just perch on the chair.,不要跨坐.,9
Ch08-01,The chair/desk is uncomfortable.,这椅子/书桌不舒服.,10
Ch08-01,The chair is too low/high.,这椅子太低/高.,11
Ch08-01,"Mom,the desk/chair is too wobbly","妈妈,这书桌/椅子太晃.",12
Ch08-01,Stop shaking the desk.,停止摇书桌.,13
Ch08-01,Don't put your head on your desk.,不要趴在书桌上.,14
Ch08-01,Don't put your hand under your chin.,不要托住下巴.,15
Ch08-01,Sit in a chair with your back up.,把腰挺直坐好.,16
Ch08-01,lean against the back of the chair.,背要靠着椅背.,17
Ch08-01,Why do you keep getting out of the chair.,为什么你一直从椅子上起来?,18
Ch08-01,Mom will push the chair in for you.,妈妈把椅子推到屁股下给你坐.,19
Ch08-01,Don't stand on the swivel chair.,不要站在旋转椅上.,20
Ch08-01,Don't spin on the chair.,不要转椅子.,21
Ch08-01,Don't sit on your knees.,不要跪坐.,22
Ch08-01,Don't lie down.,不要躺着.,23
Ch08-01,Don't shake your legs.,不要抖脚.,24
Ch08-01,It's more comfortable to sit like this.,这样坐着会舒服.,25
Ch08-01,Your back might be bent later.,以后你的背会弯曲的.,26
Ch08-01,"If you sit like that, your waist will be bent.","你那样坐的话,你的腰会弯曲的.",27
Ch08-01,Make sure not to bend to much at your waist.,确保你的腰不会太弯.,28
Ch08-01,I'm afraid you'll a swayback.,我怕你会有脊椎弯曲的问题.,29
Ch08-01,I don't want you to get bent over like an old lady.,我不希望你跟老太太一样弯腰.,30
Ch08-02,Hold your pencil right.,拿好铅笔.,1
Ch08-02,Don't hold on it too hard.,不要握得太用力.,2
Ch08-02,Hold it like Mommy.,像妈妈一样拿.,3
Ch08-02,You hold the pencil too long/short.,你铅笔拿得太长/短了.,4
Ch08-02,Write with your right hand.,用右手写写看.,5
Ch08-02,I use my left hand better.,我比较会用左手.,6
Ch08-02,Your pencil's broken.,你的铅笔断了.,7
Ch08-02,"Mom,will you sharpen my pencil?","妈妈,你能帮我削铅笔吗?",8
Ch08-03,The letters are too large/small.,字母写太大/小了.,1
Ch08-03,You want them bigger.,你的字要写大一点.,2
Ch08-03,Try to write along the line.,试着沿着线写.,3
Ch08-03,Your handwriting is sloppy.,你写得字太潦草了.,4
Ch08-03,Make your letters the same size.,把你的字母写得一样大.,5
Ch08-03,Don't write too hard.,不要写得太用力.,6
Ch08-03,Erase it with an eraser.,用橡皮擦擦掉.,7
Ch08-03,Try to write again.,试着再写一次.,8
Ch08-03,"Get it right, honey.","宝贝,要写正确.",9
Ch08-03,Write slowly.,慢慢写.,10
Ch08-03,"Should I write like this, mommy?","妈妈,我可以像这样写吗?",11
Ch08-03,How do you write this?,这个要怎么写?,12
Ch08-03,You have to space the words.,你写字要留间隔.,13
Ch08-03,The ending sound is misspelled.,你的尾音拼错了.,14
Ch08-03,It's a capital K/a lower case k.,"这个是大写K,小写k.",15
Ch08-03,Go to the next line.,写下一行.,16
Ch08-03,Put the space between the words.,单字之间要留间隔.,17
Ch08-03,I think you got the punctuation wrong.,我想你用错标点符号了.,18
Ch08-03,You spelled the word wrong.,你拼错了.,19
Ch08-03,Checking your spelling.,检查你的拼字.,20
Ch08-03,I like your handwriting.,我喜欢你写的字.,21
Ch08-03,Sit properly when writing.,当你写字时要坐正.,22
Ch08-03,"Mommy, my fingers hurt.","妈妈,我的手指痛.",23
Ch08-03,It's hard to write on unlined paper.,没有印线的纸张很难写.,24
Ch08-04,Back off from the TV.,离电视远一点.,1
Ch08-04,Back off a little more.,再往后一点.,2
Ch08-04,Don't watch TV while laying down.,不要躺着看电视.,3
Ch08-04,You are watching too close.,你电视看得太近啰.,4
Ch08-04,Turn off the TV.,关掉电视.,5
Ch08-04,BE sure to turn it off after watching it.,看完电视后一定要关掉.,6
Ch08-04,It's not good for your eyes to watch it like that.,"那样看的话,对眼睛不好.",7
Ch08-04,Are you sitting properly?,你好好坐着吗?,8
Ch08-04,You're lying down again.,你又躺下来了.,9
Ch08-04,I'll turn off the TV if you sit like that.,"如果你那样坐的话, 我会关掉电视.",10
Ch08-04,I'll turn off the TV if you don't move back.,"如果你不往后一点的话,我会关掉电视.",11
Ch08-04,You promised to watch for 30 minutes.,你答应我只看30分钟.,12
Ch08-04,This will be the last thing you watch.,这是你最后能看的了.,13
Ch08-04,Make sure you turn it off after this.,这看完后你一定要把电视关掉,14
Ch08-04,Lean on the cushion behind you.,靠在后面的靠垫,15
Ch08-04,"Mom, the sofa's uncomfortable.",妈妈，这个沙发不舒服,16
Ch08-04,"Mom, will you get me a cushion?",妈妈，你能给我一个靠垫吗？,17
Ch08-04,"Mom, will you get me something to lean on?",妈妈，你能给我一个可以靠的东西吗？,18
Ch08-04,Don't press the remote on and on.,不要一直按遥控器,19
Ch08-04,Watch TV after finishing your homework.,写完功课后，再看电视,20
Ch08-04,Finish what you need to do first.,先完成你要做的事情,21
Ch08-04,Stop watching TV and do your homework.,不要看电视，去做你的功课。,22
Ch08-04,You keep flipping through the channels.,你一直在换频道,23
Ch08-04,I think you're obsessed with TV.,我想你电视中毒了,24
Ch08-05,There are lots of things on the floor.,地板满满地都是东西,1
Ch08-05,Put it in the drawer.,把它放进抽屉,2
Ch08-05,Put them in the shelf.,把它们放上架子,3
Ch08-05,Organize your things well.,好好整理你的东西,4
Ch08-05,You should clear up.,你应该收拾你自己的东西,5
Ch08-05,Where was this before?,这个之前放在哪里？,6
Ch08-05,This doesn't belong here.,这个不是放在这里的东西,7
Ch08-05,Put this where it is supposed to be.,把这个放在它应该在的地方,8
Ch08-05,Put it where it belongs.,把它物归原位,9
Ch08-05,Put the used things back into their place.,把用过的东西放回原处,10
Ch08-05,Put the things where they belongs so you can find them easily.,把东西放在原位，这样你能很容易找到,11
Ch08-05,You should have put them in the right place,你当时应该把它们放在正确的地方,12
Ch08-05,"Mom, where should I put this?",妈妈，这个我要放哪？,13
Ch08-05,"Mom,I'll put this here.",妈妈，我把这个放在这里,14
Ch08-05,I'm going to use this now.,我现在要用这个,15
Ch08-05,Where did Mommy tell you to put this?,妈妈告诉你要把这个放哪了？,16
Ch08-05,Isn't it easy to find things since you cleaned up?,整理好之后，不是很容易找到吗？,17
Ch08-06,Hang your jacket on the hanger.,把你的外套挂衣架上,1
Ch08-06,Put it in the closet.,把它放在衣柜,2
Ch08-06,"Mom, there's nowhere to put this.",妈妈，没有地方可以放了,3
Ch08-06,"Mom, this is too small now.",妈妈，现在这件太小了,4
Ch08-06,Take out what you're not going to wear.,把你不穿的衣服拿出来,5
Ch08-06,There's a hole here.,这个有个洞,6
Ch08-06,I'll sew this for you.,我来帮你把这缝好,7
Ch08-06,Put your dirty socks in the laundry.,把脏的袜子放进洗衣篮内,8
Ch08-06,Why are these socks here?,这些袜子为什么在这里？,9
Ch08-06,I told you not to turn the socks inside out.,我告诉过你不要把袜子反过来了,10
Ch08-06,The drawers are full.,这些抽屉满了,11
Ch08-06,Let's organize our spring / summer / fall / winter clothes.,我们把春/夏/秋/冬的衣服整理好吧,12
