Ch17-02,Didn't you wear that yesterday?,你昨天不是穿了那件吗？,17
Ch17-02,"You really like those clothes,don't you?",你真的很喜欢那些衣服，对吧？,18
Ch17-02,I don't want to take this off.,我不要把这件脱下来。,19
Ch17-02,I like this the most.,我最喜欢这件了。,20
Ch17-02,I don't like to wear skirts.,我不喜欢穿裙子。,21
Ch17-02,I hate these pants.They are not comfortable.,我讨厌这条裤子。他穿起来不舒服。,22
Ch17-03,Who is your best friend in class?,在班上，谁是你最好的朋友？,1
Ch17-03,Jina is my best friend.,吉娜是我最好的朋友。,2
Ch17-03,I want to be friends with Minsuo.,我想和悯所成为朋友。,3
Ch17-03,I like my partner/deskmate.,我喜欢我的同桌伙伴。,4
Ch17-03,Tell me about your best friend.,跟我谈谈你最好的朋友。,5
Ch17-03,I like her because she's pretty and nice.,我喜欢她，因为她漂亮又善良。,6
Ch17-03,I like him because he's kind and handsome.,因为他很亲切又帅，所以我喜欢他。,7
Ch17-03,I want to marry Jina when I grow up.,我长大后，想跟吉娜结婚。,8
Ch17-03,We are perfect for each other.,我们非常适合彼此。,9
Ch17-03,Songjin understands my feelings.,宋锦很了解我的感受。,10
Ch17-03,I'm proud of my friend.,我以我的朋友为荣。,11
Ch17-03,I liked her from the moment we met first.,从第一次见面开始，我就很喜欢她。,12
Ch17-03,I want to write well like my friend.,我想跟我朋友一样很会写字。,13
Ch17-03,Can I invite her to my house?,我可以邀请她到我们家吗？,14
Ch17-03,Is your teacher nice to you?,你的老师对你好吗？,15
Ch17-03,Why do you like the teacher?,你为什么喜欢这位老师？,16
Ch17-03,Who's your role model?,谁是你的学习对象？,17
Ch17-03,I respect Marie Curie.,我尊敬居里夫人。,18
Ch17-03,I want to be a scientist like Marie Curie.,我想跟居里夫人一样成为科学家。,19
Ch17-03,My favorite singer is Rain.,我喜欢的歌手是Rain。,20
Ch17-03,Shiny's dancing and singing is cool.,Shiny的歌舞都很酷。,21
Ch17-03,I want to sing well like that singer.,我想像那位歌手一样很会唱歌。,22
Ch17-03,I don't want to play with Suji.,我不想跟苏吉玩。,23
Ch17-03,I don't like the English teacher because she is very scary.,我不喜欢那位英语老师，因为她很可怕。,24
Ch17-03,I don't like the teacher because he is too strict.,我不喜欢那位老师，因为他太严厉了。,25
Ch17-03,I don't like anyone who nags me.,我讨厌任何人对我唠叨。,26
Ch17-03,I don't like the girl over there.She is mean to me.,我不喜欢在那边的那个女孩。她对我很不好。,27
Ch17-04,I don't feel like eating.,我没心情吃饭。,1
Ch17-04,Why should I bother to do that?,我为什么要费心去做那件事？,2
Ch17-04,I don't want to do it because it's boring.,那个太无趣了，我不想做。,3
Ch17-04,"Can you do it for me,Mom?",妈，你能帮我做吗？,4
Ch17-04,Can't you let Jianmin do it instead of me?,你不能让健民代替我去做吗？,5
Ch17-04,I don't want to brush my teeth.,我不想刷牙。,6
Ch17-04,Why do I have to brush my teeth?,我为什么一定要刷牙呢？,7
Ch17-04,Don't ask me to do this and that.,不要叫我做这做那的。,8
Ch17-04,I don't want to go.,我不想去。,9
Ch17-04,Can I not do my homework?,我可以不做作业吗？,10
Ch17-04,Can I not do what I don't want to do?,我可以做我不想做的吗？,11
Ch17-04,I still have to do it even if I don't want to?,即使我不想做，也一定要做吗？,12
Ch17-04,I'll do it later.,我等一下再做。,13
Ch17-04,"Don't just say ""NO!""",不要只是说“不”。,14
Ch17-04,You need to do it even if you don't want to.,即使你不想做，你也一定要做。,15
Ch17-04,You don't have to do it if you hate it.,如果你讨厌的话，你不一定要做。,16
Ch17-04,I hope you won't feel sorry for this.,我希望你不会因此而后悔。,17
Ch17-04,"If you don't do this now,you'll be in a rush.",如果你现在不做这件事的话，你以后会手忙脚乱。,18
Ch18-01,He is very handsome./He is a good-looking boy.,他很帅。,1
Ch18-01,He is a beautiful boy.,他是美男子。,2
Ch18-01,He is a boy of noble appearance.,他长得很象贵公子。,3
Ch18-01,He is so cute./He is such a cute-looking boy.,他好可爱。,4
Ch18-01,She is pretty.,她很美。,5
Ch18-01,He is a handsome boy. / She is a pretty girl.,他是俊男。 /她是美女。,6
Ch18-01,He / She looks like a movie star.,他/她长得很像电影明星。,7
Ch18-01,He / She is a very stylish person.,他/她是位很时尚的人。,8
Ch18-01,My son is more handsome than him.,我的儿子比他帅。,9
Ch18-01,I think my daughter is prettier than her.,我觉得我女儿比她更美。,10
Ch18-01,My girl is this pretty! Who do you look like?,我女儿好漂亮喔！你长得像谁呢？,11
Ch18-01,"I just look like you, Mom.",妈，我长得像你。,12
Ch18-02,He is not really handsome.,他长得不是很帅。,1
Ch18-02,She is not really pretty.,她长得不是很漂亮。,2
Ch18-02,He / She just has a common look.,他/她长得很平凡。,3
Ch18-02,He / She looks kind of ugly.,他/她看起来算丑的。,4
Ch18-02,I have dark eyes.,我有黑眼睛。,5
Ch18-02,I have black hair.,我有黑头发。,6
Ch18-03,My mom is slender.,我妈很苗条。,1
Ch18-03,My mother stays in good shape.,我妈的身材很好。,2
Ch18-03,My mom has a curvy shape. / My mom has an hourglass figure.,我妈有S曲线。,3
Ch18-03,My mom is overweight. / My mom is big.,我妈很胖。,4
Ch18-03,My mom is a bit plump.,我妈有点丰满。,5
Ch18-03,My dad looks jacked. / My dad is a muscleman.,我爸是肌肉男。,6
Ch18-03,My dad has a big belly.,我爸的肚子很大。,7
Ch18-03,My dad is too skinny.,我爸太瘦了。,8
Ch18-04,He has big / small eyes.,他的眼睛很大/小。,1
Ch18-04,His eyes have creases.,他有双眼皮。,2
Ch18-04,She has a high nose.,她的鼻子很挺。,3
Ch18-04,She has a flat nose.,她有个塌鼻子。,4
Ch18-04,Her nose is a little flat.,她的鼻子有点塌。,5
Ch18-04,His nose is big.,他的鼻子很大。,6
Ch18-04,His mouth is big / small.,他的嘴巴很大/小。,7
Ch18-04,Her face is egg shaped. / She has an oval face.,他/她是鹅蛋脸。,8
Ch18-04,Her face is long.,她的脸很长。,9
Ch18-04,Her face is round.,她的脸很圆。,10
Ch18-04,Her head is small.,她的头很小。,11
Ch18-04,He has a big head.,他有个大头。,12
Ch18-04,He has dark eyebrows.,他有深色的眉毛。,13
Ch18-04,He has dimples.,他有酒窝。,14
Ch18-04,Her face is white.,她的脸很白。,15
Ch18-04,Her skin is fair.,她的皮肤很白。,16
Ch18-04,Her skin is dark.,她的皮肤很黑。,17
Ch18-04,Her skin is very soft.,她的皮肤很嫩。,18
Ch18-04,Her skin is not healthy. / Her skin is not clean.,她的皮肤不好。,19
Ch18-05,He's got a pointed forehead.,他有凸出的额头。,1
Ch18-05,He has a long jaw.,他有个长下巴。,2
Ch18-05,His ears are extremely long.,他的耳朵非常长。,3
Ch18-05,He has pimples.,他有青春痘。,4
Ch18-05,He has freckles.,他有雀斑。,5
Ch18-05,She has a dot next to her mouth.,她的嘴巴旁边有一颗痣。,6
Ch18-05,She has a sharp look. / She looks sharp.,她的外表很有型。,7
Ch18-05,She looks nice and warm.,她看起来人很好。,8
Ch18-05,She has an attractive smile.,她有吸引人的微笑。,9
Ch18-05,She looks sullen and unfriendly.,她看起来脸很臭，也不友善。,10
Ch18-06,My hair is curly / a little curly.,我的头发很/有点卷。,1
Ch18-06,My hair is straight.,我是直发。,2
Ch18-06,I have a lot of hair.,我有很多头发。,3
Ch18-06,My hair is thin.,我的头发很少。,4
Ch18-06,My hair is long / short.,我的头发很长/短。,5
Ch18-06,My hair is stiff.,我的头发很硬。,6
Ch18-06,My hair is silky and smooth.,我的头发像丝绸般的滑顺。,7
Ch18-06,I got my hair permed.,我把头发烫卷了。,8
Ch18-06,My hair is short in length.,我是短发。,9
Ch18-06,I got my hair cut short.,我把头发剪短了。,10
Ch18-06,I like my hair long and straight.,我喜欢我的头发又长又直。,11
Ch18-06,I like my hair short.,我喜欢留短头发。,12
Ch18-06,My brother has a crew cut.,我哥哥是平头。,13
Ch18-06,My dad has a lot of gray hair.,我爸爸有很多白头发。,14
Ch18-06,My grandpa is bald.,我爷爷是光头。,15
Ch18-06,"Can I pull out your gray hairs, Dad?",爸，我帮你把白头发拔起来，好吗？,16
Ch18-07,He is tall / short.,他很高/矮。,1
Ch18-07,He is 130cm tall.,他有130公分高。,2
Ch18-07,He's taller than 140cm. / He's over 140cm tall.,他的身高超过140公分。,3
Ch18-07,She is shorter than 120cm. / She is not even 120cm tall.,她的身高还不到120公分。,4
Ch18-07,She is taller / shorter than her peers.,她比同年纪的高/矮。,5
Ch18-07,She's short and skinny.,她又矮又瘦。,6
Ch18-07,let's see how tall you are.,我们来看看你有多高。,7
Ch18-07,You grew more in such a short time.,你在秀短的时间内长高很多。,8
Ch18-07,Wow... you have grown quite a bit!,哇...你已经长了好多喔！,9
Ch18-07,You grew 1cm.,你长高了1公分。,10
Ch18-07,You're a little taller / shorter than Jina.,你比吉娜高/矮一点。,11
Ch18-07,I want to be taller.,我想再高一点。,12
Ch18-07,Who's the tallest in your class?,在你的班上，谁最高？,13
Ch18-07,Minsu is the tallest in our class.,民肃是我们班上最高的。,14
Ch18-07,I want to be tall like Dad.,我想长得跟爸一样高。,15
Ch18-07,I wish I could be taller.,我希望我再高一点就好了。,16
Ch18-07,I'm jealous of tall people.,我忌妒高的人。,17
Ch18-07,Your height is perfect.,你的身高刚刚好。,18
Ch18-07,You'll grow more if you eat well.,如果你好好吃饭的话，你会长得更快。,19
Ch18-07,You need to drink milk to grow taller.,你要多喝牛奶，才能长得更高。,20
Ch18-07,You need to go to sleep early to grow taller.,你早点睡觉，才能长得更高。,21
Ch18-07,There are people who grow late.,也用些人长得比较慢。,22
Ch18-07,Mom also began to get taller late. / Mom also had a late growth spurt.,妈妈也是后来才长高的。,23
Ch18-08,I am overweight.,我很胖。,1
Ch18-08,I weigh 20kg.,我的体重是20公斤。,2
Ch18-08,Let's measure your weight.,我们来量一下你的体重。,3
Ch18-08,Step on the scale.,站到体重机上。,4
Ch18-08,You've lost / gained weight.,你的体重增加/减少了。,5
Ch18-08,It looks like you've gained weight.,看起来你好像增重了。,6
Ch18-08,You weigh a lot / a little.,你很/不怎么重。,7
Ch18-08,You look good because you're slim.,因为你很苗条，看起来不错。,8
Ch18-08,You are pleasingly plump.,你胖得很好看。,9
Ch18-08,I like to stay in good shape.,我喜欢保持健康的体能。,10
Ch18-08,I want to lose weight.,我想减肥。,11
Ch18-08,You are not overweight at all.,你一点都不胖。,12
Ch18-08,You should lose weight by exercising.,你应该透过运动来减轻体重。,13
Ch18-08,You need some workouts to lose weight.,你需要运动来减肥。,14
Ch18-08,You should go on a diet.,你应该减肥。,15
Ch18-08,Try to eat less from now on.,现在开始，试着少吃一点。,16
Ch18-08,Don't eat too many snacks now.,现在不要吃太多点心。,17
Ch18-08,You need to gain weight.,你应该增加一些体重。,18
Ch18-08,You don't need to lose weight.,你不需要减肥。,19
Ch18-08,It's bad to starve to lose weight.,透过挨饿来减肥很不好。,20
Ch18-08,I can get fat even from drinking water.,我喝水也会变胖。,21
Ch18-08,My friends call me a fatty.,我的朋友们都叫我胖子。,22
Ch18-08,It's bad to make fun of people for their looks.,取笑别人的外表是不好的。,23
Ch18-08,Obesity is bad for your health. / Being overweight is bad for your health.,过胖对健康是有害的。,24
Ch18-09,I want to be taller.,我想要更高。,1
Ch18-09,I want my skin to be whiter.,我希望我的皮肤可以更白。,2
Ch18-09,I want my hair to be longer.,我希望我的头发可以更长。,3
Ch18-09,I want to be prettier.,我想变得更美。,4
Ch18-09,I wish my eyes were bigger.,我希望我的眼睛可以更大。,5
Ch18-09,"Am I ugly, Mom?",妈，我很丑吗？,6
Ch18-09,You're pretty enough.,你已经够美了。,7
Ch18-09,You're adorable the way you are.,你这样就很可爱了。,8
Ch18-09,I'm jealous of my pretty friends.,我忌妒长得漂亮的朋友。,9
Ch18-09,What's inside you is more important than what's outside.,内在比外表更重要。,10
Ch18-09,Don't judge people by their looks. / Don't judge a book by its cover.,不可以只透过外表来评判一个人。,11
Ch18-09,It seems like I have Mom's and Dad's bad traits.,我好像遗传了爸妈的缺点。,12
Ch18-09,You have your own charm.,你有你自己的魅力。,13
Ch18-09,I want to wear pretty clothes.,我想穿美丽的衣服。,14
Ch18-09,Clothes have to be clean.,衣服只要干净就可以了。,15
Ch19-01,"Hello, Minsu!",民肃，你好！,1
Ch19-01,Hello!,哈啰！,2
Ch19-01,Good morning! / Good afternoon! / Good evening!,早安！/午安！/晚安！,3
Ch19-01,How are you?,你好吗？,4
Ch19-01,How's everything going?,一切顺利吗？,5
Ch19-01,"Nice to meet you, Jina.",吉娜，很高兴认识你。,6
Ch19-01,Long time no see!,好久不见！,7
Ch19-01,Good to see you again.,很高兴再次见到你。,8
Ch19-01,Are your parents fine?,你的父母好吗？,9
Ch19-01,How are your parents?,你的父母近况如何？,10
Ch19-01,Is your brother / sister well?,你的兄弟/姐妹好吗？,11
Ch19-01,Nice to see you.,很高兴见到你。,12
Ch19-01,How do you do?,你好吗？,13
Ch19-01,I've heard a lot about you.,我听说了很多有关你的事情。,14
Ch19-01,Fancy meeting you here.,很高兴在这里见到你。,15
Ch19-01,What brings you here?,是什么风把你吹来的？,16
Ch19-01,I didn't expect I would see you here.,我没想到会在这里遇到你。,17
Ch19-01,Let's shake hands.,我们来握手吧。,18
Ch19-01,It's been quite a while since we met.,从上次见面已经有一段时间了。,19
Ch19-01,I missed you.,我很想你。,20
Ch19-01,Why didn't you keep in touch?,为什么你没有保持联络？,21
Ch19-02,Goodbye.,拜拜。,1
Ch19-02,See you again.,下次见。,2
Ch19-02,See you later.,晚点见。,3
Ch19-02,Good night. See you in the morning.,晚安。明天早上见。,4
Ch19-02,Bye. See you then.,拜。到时见。,5
Ch19-02,See you on Monday.,周一见。,6
Ch19-02,Take care.,保重。,7
Ch19-02,Have a good weekend.,周末愉快。,8
Ch19-02,See you next week.,下周见。,9
Ch19-02,Have a good day.,祝你有愉快的一天。,10
Ch19-02,I'm going to miss you.,我会想念你的。,11
Ch19-02,Say hi to your Mom for me.,帮我跟你妈妈问好。,12
Ch19-02,Let's keep in touch.,我们保持联络吧。,13
Ch19-02,Call me when you get home.,你到家后，打电话给我。,14
Ch19-02,Text me when you get home. / Give me a text message when you get home.,当你到家后，传给简讯给我。,15
Ch19-02,Email me. / Write me.,写Email给我。,16
Ch19-02,I don't want to say goodbye.,我不想说再见。,17
Ch19-02,I've enjoyed your company.,我很开心有你的陪伴。,18
Ch19-02,I won't forget you.,我不会忘记你。,19
Ch19-03,Thank you.,谢谢。,1
Ch19-03,Thank you very much.,非常谢谢你。,2
Ch19-03,I'm so grateful for that.,我真的很感谢那件事。,3
Ch19-03,Thank you for the compliment.,谢谢你的称赞。,4
Ch19-03,Thank you.I'll pay you back.,谢谢。我会回报你的。,5
Ch19-03,It's fine.,没关系。,6
Ch19-03,No problem./It was not a big deal.,这没什么。,7
Ch19-03,You're welcome.,不客气。,8
Ch19-03,Thank you for helping me.,谢谢你帮了我。,9
Ch19-03,"Mom,thank you for everything.",妈，谢谢你的一切。,10
Ch19-03,Thank you for everyting you've done for me.,谢谢你为我做的一切。,11
Ch19-03,I‗m the one who should say thanks.,我才是要说谢谢的人。,12
Ch19-03,I don't know how to thank you.,我不知道该怎么谢谢你。,13
Ch19-03,Here's a little present.,这里有个小礼物。,14
Ch19-03,I want to express my thanks.,我想表达我的感谢之情。,15
Ch19-03,It's a thank-you note.,这是感谢信。,16
Ch19-03,It's a great present.,这礼物太棒了。,17
Ch19-03,Say thank you to your brother.,跟你弟弟说谢谢。,18
Ch19-03,You should learn to say thanks.,你应该学习说谢谢。,19
Ch19-04,"I'm sorry,Mom.",妈，对不起。,1
Ch19-04,I'm really sorry.,我真的很抱歉。,2
Ch19-04,It's okay./No problem.,没关系。,3
Ch19-04,Don't worry.,不用担心。,4
Ch19-04,I'm sorry I'm late.,不好意思，我迟到了。,5
Ch19-04,I'm sorry.It was my fault.,对不起，是我的错。,6
Ch19-04,Never mind.,不用在意。,7
Ch19-04,Just forget it.,就忘记它吧。,8
Ch19-04,"Mom, forgive me please.",妈，请你原谅我。,9
Ch19-04,I'm sorry for the trouble I've caused.,我很抱歉造成这样的麻烦。,10
Ch19-04,That's not a problem.,那不是个问题。,11
Ch19-04,I didn't mean to do that.,我不是故意的。,12
Ch19-04,It was a mistake.,这是个失误。,13
Ch19-04,I‗ll forgive you.,我会原谅你的。,14
Ch19-04,I'll pay for it.,我会培的。,15
Ch19-04,Say sorry to your sister.,跟你妹妹说对不起。,16
Ch19-04,Apologizing isn't something to be shy of.,道歉不是丢脸的行为。,17
Ch19-04,Just saying sorry isn't enough.,只是说道歉是不够的。,18
Ch19-04,Adults also make mistakes.,大人也会犯错的。,19
Ch20-01,Let me introduce myself.,我来自我介绍。,1
Ch20-01,My name is Jina.,我的名字是吉娜。,2
Ch20-01,Nice to meet you.I'm Minsu Lee.,很高兴认识你。我是李民肃。,3
Ch20-01,Glad to meet you.I'm Matthew.,很高兴认识你。我是Matthew.,4
Ch20-01,What school do you go to?Where do you go to school?,你在哪所学校上学？,5
Ch20-01,I go to Taipei Elementary School.,我在台北国小读书。,6
Ch20-01,What grade are you in?,你几年级了？,7
Ch20-01,I’m in first grade./I'm a first grader.,我是一年级。,8
Ch20-01,How old are you?,你几岁了？,9
Ch20-01,I'm 8 years old.,我八岁了。,10
Ch20-01,What's your hobby?,你的兴趣是什么？,11
Ch20-01,I like playing the piano.,我喜欢弹钢琴。,12
Ch20-01,Where were you born?,你在哪里出生？,13
Ch20-01,I was born in Kaohsiung.,我在高雄出生。,14
Ch20-01,Where are you from?/What country are you from?,你从哪个国家来？,15
Ch20-01,I'm from China.,我来自中国。,16
Ch20-01,I'm a native of Beijing.,我是北京当地人。,17
Ch20-01,What do you like to do?,你喜欢做什么？,18
Ch20-01,I like to play with my friends.,我喜欢跟我的朋友们玩。,19
Ch20-01,I like to draw.,我喜欢画画。,20
Ch20-01,What do you want to be in the future?,你将来想当什么？,21
Ch20-01,I want to be a pianist.,我想当钢琴家。,22
Ch20-01,I want to be a pianist when I grow up.,长大后我想当钢琴家。,23
Ch20-02,How many people are there in your family?/How many people do you have in your family?,你家里有几个人？,1
Ch20-02,There are four people in my family.,我家有四个人。,2
Ch20-02,"Four.My mom,dad,sister,and me.",四个。妈妈、爸爸、姐姐、还有我。,3
Ch20-02,"My dad,mom,brother,and I are in my family.",我家有爸爸、妈妈、哥哥、还有我。,4
Ch20-02,"I live with my mom,dad,and sister.",我和妈妈、爸爸、姐姐住一起。,5
Ch20-02,We are a small family.,我们是小家庭。,6
Ch20-02,We are a big family.,我们是大家庭。,7
Ch20-02,We have a lot of people in our family.,我家有许多人。,8
Ch20-02,Do you have any siblings?,你有其他兄弟姐妹吗？,9
Ch20-02,Do you have any brothers or sisters?,你有任何兄弟姐妹吗？,10
Ch20-02,"Yes,I have two sisters.",是的。我有两个姐姐。,11
Ch20-02,I have a brother but not a sister.,我有一个弟弟，但是没有妹妹。,12
Ch20-02,"No,I'm an only child.",没有，我是独生子。,13
Ch20-02,I’m the youngest in the family.,在我家，我是老幺。,14
Ch20-02,I'm the oldest in the family.,我是家中最大的小孩。,15
Ch20-03,What does your father do?,你爸爸做什么？,1
Ch20-03,He works in some company.,他在某家公司上班。,2
Ch20-03,He works for a computer company.,他在电脑公司上班。,3
Ch20-03,He works for ASUS.,他为华硕电脑工作。,4
Ch20-03,He works for government.,他为政府工作。,5
Ch20-03,My mom teaches at a school.,我妈妈在学校教书。,6
Ch20-03,My mon is a homemaker.,我妈妈是家庭主妇。,7
Ch20-03,My parents both work.,我爸妈都有工作。,8
Ch20-03,My dad is very strict.,我爸很严厉。,9
Ch20-03,Daddy's too busy to play with me often.,爸爸太忙了，不能常跟我玩。,10
Ch20-03,Daddy plays with us on weekends.,爸爸在周末跟我们玩。,11
Ch20-03,Daddy helps clean the house.,爸爸帮忙打扫房间。,12
Ch20-03,My mom's a good cook.,我妈很会做饭。,13
Ch20-03,Mommy's busy because she has to take care of us.,因为妈妈要照顾我们，所以很忙。,14
Ch20-03,I look a lot like my mom.,我长得跟妈妈很像。,15
Ch20-03,My mom and dad are in a good relationship.,我妈和我爸的感情很好。,16
Ch20-03,I respect my parents.,我尊敬我的爸妈。,17
Ch20-03,My parents got divorced.,我爸妈离婚了。,18
Ch20-03,How are your grandparents?,你的祖父母好吗？,19
Ch20-03,They're both healthy.,他们都很健康。,20
Ch20-03,My grandfather passed away.,我爷爷已经过世了。,21
Ch20-03,My gandmother died when I was young.,我奶奶在我很小的时候就去世了。,22
Ch20-03,How old is your grandfather?,你外公几岁了？,23
Ch20-03,He's 66 years old.,他有66岁了。,24
Ch20-03,My grandfather lives with us.,外公跟我们住在一起。,25
Ch20-03,My grandmother isn't very healthy.,我外婆不是很健康。,26
Ch20-03,My grandparents really love me.,我的外公外婆真的很爱我。,27
Ch20-03,My grandparents are nice to me.,外公外婆对我很好。,28
Ch20-03,I love my grandparents the most.,我最爱我的外公外婆了。,29
Ch20-04,How old is your younger sister?,你妹妹几岁？,1
Ch20-04,She's 5 years old.,她五岁了。,2
Ch20-04,How much older than your brother are you?,你比你弟弟大几岁？,3
Ch20-04,We are 3 years apart.,我们差三岁。,4
Ch20-04,My brother is 3 years younger than me.,我弟弟比我小三岁。,5
Ch20-04,My sister is 3 years older than me.,我姐姐比我大三岁。,6
Ch20-04,Are you and your brother nice to each other?/Do you get along well with your brother?,你跟弟弟处的好吗？,7
Ch20-04,I always get in fights with my brother.,我总是跟弟弟打架。,8
Ch20-04,My brother and I have a lot in common.,我和弟弟有很多共同点。,9
Ch20-04,My brother and I are very different.,我和弟弟很不一样。,10
Ch20-04,We are twins.,我们是双胞胎。,11
Ch20-04,We are identical twins.,我们是同卵双胞胎。,12
Ch20-04,We are different-looking twins.,我们是异卵双胞胎。,13
Ch20-04,I miss my brother when he's not here.,弟弟不在这时，我会很想他。,14
Ch20-04,My brother is a little troublemaker.,我弟弟是个小捣蛋鬼。,15
Ch20-04,My brother is always monkeying around.,我弟弟总是到处胡闹。,16
Ch20-04,My sister is in kindergarten./My sister goes to kindergarten.,我妹妹在上幼稚园。,17
Ch20-04,My sister is in college./My sister goes to college.,我妹妹在上大学。,18
Ch20-04,My brother is very nice to me.,我哥哥对我很好。,19
Ch20-05,I have a lot of relatives.,我有很多亲戚。,1
Ch20-05,I don't have many relatives.,我的亲戚不多。,2
Ch20-05,I have many aunts and uncles.,我有很多阿姨和叔叔。,3
Ch20-05,I have one aunt and one uncle.,我有一位姑姑和一位伯伯。,4
Ch20-05,My aunt lives in Seoul.,我阿姨住在首尔。,5
Ch20-05,I go to my relative's house during school break.,学校放假的时候，我会去亲戚家玩。,6
Ch20-05,We all get together during holidays.,过节的时候，我们会聚在一起。,7
Ch20-05,I have a lot of cousins.,我有很多表兄妹。,8
Ch20-05,I get along well with my cousins./My cousins and I are friends with each other.,我跟我的堂兄妹相处的很好。,9
Ch20-05,My cousins and I play at my grandparents' house.,我和堂哥们在我祖父家玩。,10
Ch20-05,I meet my aunts often.,我经常跟婶婶们见面。,11
Ch20-05,My uncle sometimes comes to our house.,伯伯有时会来我家。,12
Ch20-05,One of my uncles lives in America.,我有一位叔叔住在美国。,13
Ch20-06,I have a dog.,我有一只狗。,1
Ch20-06,His name is Happy.,它的名字叫Happy.,2
Ch20-06,He shakes his tail when I get back from school.,当我放学回来时，它会摇尾巴。,3
Ch20-06,He is trained well.,它被训练的很好。,4
Ch20-06,We've had him for 2 years.,我们养它养老两年。,5
Ch20-06,He is 5 years old.,它5岁了。,6
Ch20-06,Happy doesn's like to take baths.,Happy不喜欢洗澡。,7
Ch20-06,Happy always follows me around.,Happp总是跟着我跑来跑去。,8
Ch20-06,Happy is a member of our family.,Happy是我们家的一员。,9
Ch20-06,Happy likes to take a walk with me.,Happy喜欢跟我去散步。,10
Ch20-06,Happy.knows how to do some tricks./Happy can do some tricks.,Happy会做一些特技。,11
Ch20-06,Happy can jump and roll.,Happy会跳和滚。,12
Ch20-06,He's jumpy when I give him treats.,当我请他吃东西时，它就会跳。,13
